{"commands":[{"argv":["/usr/bin/python3","-m","axiomlint","governance","check","--root","."],"exit_code":0,"name":"governance","status":"PASS","stderr_bytes":0,"stderr_sha256":"e3b0c44298fc1c149afbf4c8996fb92427ae41e4649b934ca495991b7852b855","stdout_bytes":81,"stdout_sha256":"25f31c6553c86108593662ab587eed0ca09a876dd01c7c8e3ba2e277dc92083b","wall_seconds":0.06507190499996796},{"argv":["/usr/bin/python3","tools/hygiene_check.py"],"exit_code":0,"name":"hygiene","status":"PASS","stderr_bytes":0,"stderr_sha256":"e3b0c44298fc1c149afbf4c8996fb92427ae41e4649b934ca495991b7852b855","stdout_bytes":43,"stdout_sha256":"68bab1876908f721d2208e7c42fc579def817072a07032aabf7fca1ffb529f59","wall_seconds":0.04659156700017775},{"argv":["/usr/bin/python3","tools/hygiene_check.py","--syntax"],"exit_code":0,"name":"syntax","status":"PASS","stderr_bytes":0,"stderr_sha256":"e3b0c44298fc1c149afbf4c8996fb92427ae41e4649b934ca495991b7852b855","stdout_bytes":48,"stdout_sha256":"ecedeeb3b7600d97a2087f304a834713ab9d22d4b5897559b6ac3e6c4fbb9c9c","wall_seconds":0.0746534440004325},{"argv":["/usr/bin/python3","tools/run_tests.py"],"exit_code":0,"name":"tests","status":"PASS","stderr_bytes":25572,"stderr_sha256":"e020e4d20c19d6f0ee891ffe44ac2e0406c7e435579746985d8c29b9c70579cd","stdout_bytes":45,"stdout_sha256":"94136267937cea3c11756d6cba44d6c2bbfc8825a021a8c9575737b786c18b66","wall_seconds":7.646500701999685}],"commit":"b4626c6651bb2912674c3be1843e6a19cbc4ba25","dirty":false,"environment_policy":"ALLOWLIST_NO_CREDENTIALS","kind":"ACCEPTANCE_CANDIDATE","limitations":["Not independent S2, maintainer approval, package closure or security certification","Trusted repository tests only; no subject-code sandbox or memory/PID/output isolation","No hosted checks, network clients, dependency resolvers or model/solver calls invoked","Child allowlist is hygiene, not enforcement preventing trusted tests from networking","Ruff/mypy/coverage/SCA/SBOM/Nix/OCI/Windows/formal backends deferred","Local unsigned digests do not provide authenticated malicious-host protection"],"machine":"x86_64","manifest_schema_sha256":"1462261e123749549ae20e5c84db9eeea4e7554c616db2c256aa4ba504954904","platform":"Linux-7.1.5-76070105-generic-x86_64-with-glibc2.39","python":"3.12.3 (main, Aug 31 2026, 10:18:26) [GCC 13.3.0]","run_id":"20261021T075436Z-7f90f1824266","schema_version":"0.2","source_identity_algorithm":"sha256-path-bytes-gitmode-v1","source_tree_after_sha256":"a85dca5c2ae0a6c4f0797b4c733ace7fb09c9e24c3f28adf4c5afa03ef2f0059","source_tree_sha256":"a85dca5c2ae0a6c4f0797b4c733ace7fb09c9e24c3f28adf4c5afa03ef2f0059","started_utc":"2026-10-21T07:54:36.517242+00:00","status":"PASS"}
